{
  "id": "smoke-id-selector",
  "expectedError": "invalid_smoke_selector",
  "description": "Bundled smoke tests must use stable data-testid selectors instead of brittle id selectors.",
  "files": [
    {
      "path": "smoke-tests.json",
      "content": "[{\"name\":\"brittle selector\",\"steps\":[{\"type\":\"click\",\"selector\":\"#new-note\"}],\"expected\":{\"textIncludes\":\"No notes yet\"}}]"
    }
  ]
}
